{
  "schemaVersion": 1,
  "jarSha256": "b1aa84cbacf1057746bc5936308345cfdddb8f3fc78b63377af59da05dc0ce10",
  "jarSizeBytes": 164085159,
  "javaSha256": "9be1d0a740ff6502df1a762145e62860f5de4b7e17658d9cb9498da3acf9d16c",
  "expected": {
    "buildInfoStatus": "AVAILABLE",
    "console": {
      "node": "v24.21.0",
      "npm": "11.19.0",
      "sourceFingerprint": "4df95293576a4baaa63639d3540ae6657b89c0eae80b1e2e2f7f9e6412a32c73"
    },
    "contract": {
      "definitionSha256": "bffe91e25a3c58db7626fadbb8333b5216ab293b7760dee033f2fdf974841687",
      "documentationSha256": "f52c8ef1c31fa51b269da547139e72ba90e6131198e351ee3426b760b5e3db95",
      "fingerprint": "bac1756a81f2d2ddf67ae094fc770bc67060482acab87da7d48b93d441ab8f88",
      "revision": "67c9f8e5100f6ce0df7fc8271eb9d56a8ee7a36b",
      "runtimeDocumentationSha256": "ec52f844e9291f6a3cd17a4d93e58a71c2acd651e1706c9c7f9b53b6842cf43e",
      "runtimeFixtureSha256": "c64d4003e8b7dba63845f17dfe1386546988640e1af61fba478206c83402c01e",
      "status": "PROPOSED"
    },
    "distribution": {
      "channel": "development",
      "officialRelease": false
    },
    "engine": "NIGO",
    "java": {
      "requiredMajor": 21
    },
    "source": {
      "commit": "67c9f8e5100f6ce0df7fc8271eb9d56a8ee7a36b",
      "dirty": false
    },
    "version": "0.0.1-SNAPSHOT"
  }
}
