{
  "schemaVersion": 1,
  "jarSha256": "05a38bd1de45d16f0529a8689c113d6a359989ff0cd95e4c507bfc49843ee46f",
  "jarSizeBytes": 164088530,
  "javaSha256": "9be1d0a740ff6502df1a762145e62860f5de4b7e17658d9cb9498da3acf9d16c",
  "expected": {
    "buildInfoStatus": "AVAILABLE",
    "console": {
      "node": "v24.21.0",
      "npm": "11.19.0",
      "sourceFingerprint": "a76e634dacf728b81cd446cdeaa2b6a250e1a2a91c505153dd424fd46431e99e"
    },
    "contract": {
      "definitionSha256": "988648d06b95d372cfc36a88fbf4a88ae7deb4a3477ad8629163daa03f902e49",
      "documentationSha256": "a284e1502b298dd755704378e168811373b860665dfba14ed3069d0f6c8431d6",
      "fingerprint": "c604b1d24097015b2839d97f2bc9d45e3fff91ed6984665d1aa827a155c7b6e8",
      "revision": "7ec5abd8c98e1cf070763a16f815e9281b74a5c1",
      "runtimeDocumentationSha256": "ec52f844e9291f6a3cd17a4d93e58a71c2acd651e1706c9c7f9b53b6842cf43e",
      "runtimeFixtureSha256": "c64d4003e8b7dba63845f17dfe1386546988640e1af61fba478206c83402c01e",
      "status": "PROPOSED"
    },
    "distribution": {
      "channel": "development",
      "officialRelease": false
    },
    "engine": "NIGO",
    "java": {
      "requiredMajor": 21
    },
    "source": {
      "commit": "7ec5abd8c98e1cf070763a16f815e9281b74a5c1",
      "dirty": false
    },
    "version": "0.0.1-SNAPSHOT"
  }
}
